{
  "$schema": "https://json-schema.org/draft/2020-12/schema",
  "$id": "https://swimfrancisco.com/schemas/reviewed-snapshot.json",
  "title": "Attested snapshot",
  "description": "Attested snapshot of a pool schedule extraction. Locks a canonical payload to a source hash. Attestor is human Save, CI publish-pending, or carry.",
  "type": "object",
  "required": [
    "slug",
    "reviewed_at",
    "payload"
  ],
  "additionalProperties": false,
  "properties": {
    "slug": {
      "type": "string",
      "pattern": "^[a-z0-9-]+$",
      "description": "Pool slug. Must match the containing directory name."
    },
    "pdf_sha256": {
      "type": "string",
      "pattern": "^[0-9a-f]{64}$",
      "description": "SHA-256 of the source PDF bytes. Locks this snapshot to that exact document."
    },
    "reviewed_at": {
      "type": "string",
      "format": "date",
      "pattern": "^[0-9]{4}-[0-9]{2}-[0-9]{2}$",
      "description": "Pacific date of the attestor action (human Save or CI publish-pending), not necessarily a human cell check."
    },
    "attested_by": {
      "type": "string",
      "enum": [
        "human",
        "ci",
        "agent-reference"
      ],
      "description": "Who signed or produced this snapshot. Agent references are development evidence, not human approval. Omit on legacy files. Carry copies the prior value and sets carried_from."
    },
    "carried_from": {
      "type": "string",
      "description": "Repo-relative path of a prior attested snapshot (human, CI, or omitted attested_by) this one was auto-carried from. reviewed_at keeps the original attestation date."
    },
    "source_pdf_url": {
      "type": "string",
      "format": "uri",
      "description": "Canonical URL the PDF was fetched from at review time."
    },
    "payload": {
      "type": "object",
      "required": [
        "effective_start",
        "schedule_basis",
        "sessions",
        "closures"
      ],
      "additionalProperties": false,
      "properties": {
        "effective_start": {
          "type": "string",
          "format": "date",
          "pattern": "^[0-9]{4}-[0-9]{2}-[0-9]{2}$",
          "description": "Start of the window this schedule is valid for."
        },
        "schedule_basis": {
          "type": "string",
          "enum": [
            "swim_schedule",
            "pool_hours",
            "facility_hours",
            "amenity_only",
            "temporarily_closed",
            "unknown"
          ],
          "description": "What the source proves: a true swim schedule, pool hours, facility hours, amenity existence, temporary closure, or unknown."
        },
        "effective_end": {
          "type": [
            "string",
            "null"
          ],
          "format": "date",
          "pattern": "^[0-9]{4}-[0-9]{2}-[0-9]{2}$",
          "description": "Optional end date of the schedule window. Null or omitted if open-ended."
        },
        "sessions": {
          "type": "array",
          "description": "Weekly swim sessions. May be empty when access_hours carries an access-only source.",
          "items": {
            "$ref": "#/$defs/session"
          }
        },
        "access_hours": {
          "type": "array",
          "description": "Weekly facility, member, or public day-use access windows that are not strong enough to count as swim sessions.",
          "items": {
            "$ref": "#/$defs/access_hour"
          }
        },
        "access_exceptions": {
          "type": "array",
          "description": "Date-specific access windows that override weekly access_hours, such as holiday hours.",
          "items": {
            "$ref": "#/$defs/access_exception"
          }
        },
        "closures": {
          "type": "array",
          "description": "Dated closures (holidays, training, maintenance).",
          "items": {
            "$ref": "#/$defs/closure"
          }
        }
      }
    },
    "bundle_sha256": {
      "type": "string",
      "pattern": "^[0-9a-f]{64}$"
    },
    "source_bundle": {
      "type": "array",
      "minItems": 2,
      "maxItems": 2,
      "items": {
        "type": "object",
        "additionalProperties": false,
        "required": [
          "pool",
          "url",
          "sha256",
          "capture",
          "configuration"
        ],
        "properties": {
          "pool": {
            "enum": [
              "cool",
              "warm"
            ]
          },
          "url": {
            "type": "string",
            "format": "uri"
          },
          "sha256": {
            "type": "string",
            "pattern": "^[0-9a-f]{64}$"
          },
          "capture": {
            "type": "string",
            "pattern": "^[0-9]{4}-[0-9]{2}-[0-9]{2}-[0-9a-f]{12}$"
          },
          "configuration": {
            "type": "object"
          }
        }
      }
    },
    "direct_source": {
      "type": "object",
      "required": [
        "sha256",
        "url",
        "requested_url",
        "observed_on",
        "configuration"
      ],
      "additionalProperties": false,
      "properties": {
        "sha256": {
          "type": "string",
          "pattern": "^[a-f0-9]{64}$"
        },
        "url": {
          "type": "string",
          "format": "uri"
        },
        "requested_url": {
          "type": "string",
          "format": "uri"
        },
        "observed_on": {
          "type": "string",
          "format": "date"
        },
        "configuration": {
          "type": "object"
        },
        "freshness_days": {
          "const": 14
        }
      }
    }
  },
  "$defs": {
    "session": {
      "type": "object",
      "required": [
        "day",
        "type",
        "start",
        "end"
      ],
      "additionalProperties": false,
      "properties": {
        "day": {
          "enum": [
            "monday",
            "tuesday",
            "wednesday",
            "thursday",
            "friday",
            "saturday",
            "sunday"
          ]
        },
        "type": {
          "enum": [
            "lap_swim",
            "family_swim",
            "senior_swim"
          ],
          "description": "Session category. Add new values here first, then teach the template."
        },
        "start": {
          "type": "string",
          "pattern": "^([01][0-9]|2[0-3]):[0-5][0-9]$",
          "description": "24-hour start time, HH:MM."
        },
        "end": {
          "type": "string",
          "pattern": "^([01][0-9]|2[0-3]):[0-5][0-9]$",
          "description": "24-hour end time, HH:MM. Must be strictly greater than start."
        },
        "pool": {
          "type": "string",
          "description": "Optional sub-pool identifier for multi-pool venues (e.g. 'deep', 'shallow')."
        },
        "evidence": {
          "type": "string",
          "description": "Optional verbatim PDF line this session came from. Stripped on canonicalization."
        },
        "notes": {
          "type": "string",
          "description": "Optional reviewer note. Stripped on canonicalization."
        },
        "physical_pool": {
          "enum": [
            "cool",
            "warm"
          ],
          "description": "Physical North Beach pool identified by the document title, separate from its cell allocation."
        },
        "pool_label_raw": {
          "type": [
            "string",
            "null"
          ],
          "description": "Literal printed cell allocation."
        },
        "source_sha256": {
          "type": "string",
          "pattern": "^[0-9a-f]{64}$"
        },
        "source_cell": {
          "type": "string",
          "minLength": 1
        },
        "excluded_dates": {
          "type": "array",
          "uniqueItems": true,
          "items": {
            "type": "string",
            "format": "date",
            "pattern": "^[0-9]{4}-[0-9]{2}-[0-9]{2}$"
          }
        }
      }
    },
    "access_hour": {
      "type": "object",
      "required": [
        "day",
        "start",
        "end",
        "label"
      ],
      "additionalProperties": false,
      "properties": {
        "day": {
          "enum": [
            "monday",
            "tuesday",
            "wednesday",
            "thursday",
            "friday",
            "saturday",
            "sunday"
          ]
        },
        "start": {
          "type": "string",
          "pattern": "^([01][0-9]|2[0-3]):[0-5][0-9]$"
        },
        "end": {
          "type": "string",
          "pattern": "^([01][0-9]|2[0-3]):[0-5][0-9]$"
        },
        "label": {
          "type": "string",
          "minLength": 1
        },
        "evidence": {
          "type": "string"
        },
        "notes": {
          "type": "string"
        }
      }
    },
    "access_exception": {
      "type": "object",
      "required": [
        "date",
        "start",
        "end",
        "label",
        "reason"
      ],
      "additionalProperties": false,
      "properties": {
        "date": {
          "type": "string",
          "format": "date",
          "pattern": "^[0-9]{4}-[0-9]{2}-[0-9]{2}$"
        },
        "start": {
          "type": "string",
          "pattern": "^([01][0-9]|2[0-3]):[0-5][0-9]$"
        },
        "end": {
          "type": "string",
          "pattern": "^([01][0-9]|2[0-3]):[0-5][0-9]$"
        },
        "label": {
          "type": "string",
          "minLength": 1
        },
        "reason": {
          "type": "string",
          "minLength": 1
        },
        "evidence": {
          "type": "string"
        },
        "notes": {
          "type": "string"
        }
      }
    },
    "closure": {
      "type": "object",
      "required": [
        "start",
        "end",
        "reason"
      ],
      "additionalProperties": false,
      "properties": {
        "start": {
          "type": "string",
          "format": "date",
          "pattern": "^[0-9]{4}-[0-9]{2}-[0-9]{2}$"
        },
        "end": {
          "type": "string",
          "format": "date",
          "pattern": "^[0-9]{4}-[0-9]{2}-[0-9]{2}$",
          "description": "Must be \u2265 start. Single-day closures use start == end."
        },
        "reason": {
          "type": "string",
          "minLength": 1
        },
        "start_time": {
          "type": "string",
          "pattern": "^([01][0-9]|2[0-3]):[0-5][0-9]$",
          "description": "Optional 24-hour HH:MM marking the start of a partial-day closure. Required together with end_time. Only valid on single-day closures (start == end)."
        },
        "end_time": {
          "type": "string",
          "pattern": "^([01][0-9]|2[0-3]):[0-5][0-9]$",
          "description": "Optional 24-hour HH:MM marking the end of a partial-day closure. Must be strictly greater than start_time."
        },
        "physical_pool": {
          "enum": [
            "cool",
            "warm"
          ],
          "description": "Omitted for a facility-wide closure; otherwise applies only to this physical pool."
        },
        "reason_code": {
          "type": "string",
          "pattern": "^[a-z][a-z0-9_]*$"
        },
        "source_notices": {
          "type": "array",
          "minItems": 1,
          "items": {
            "type": "object",
            "required": [
              "id",
              "text"
            ],
            "additionalProperties": false,
            "properties": {
              "id": {
                "type": "string",
                "minLength": 1
              },
              "text": {
                "type": "string",
                "minLength": 1
              },
              "source_sha256": {
                "type": "string",
                "pattern": "^[a-f0-9]{64}$"
              }
            }
          }
        }
      },
      "dependentRequired": {
        "start_time": [
          "end_time"
        ],
        "end_time": [
          "start_time"
        ]
      }
    }
  },
  "oneOf": [
    {
      "required": [
        "pdf_sha256",
        "source_pdf_url"
      ],
      "not": {
        "anyOf": [
          {
            "required": [
              "bundle_sha256"
            ]
          },
          {
            "required": [
              "source_bundle"
            ]
          }
        ]
      }
    },
    {
      "required": [
        "bundle_sha256",
        "source_bundle"
      ],
      "not": {
        "anyOf": [
          {
            "required": [
              "pdf_sha256"
            ]
          },
          {
            "required": [
              "source_pdf_url"
            ]
          }
        ]
      }
    }
  ]
}
