{
  "pdf_sha256": "beee5f5fe269e0445b7464896a5c585aaf4f5fa760b1f411148851366c62a2a8",
  "source_pdf_url": "https://www.jccsf.org/fitness/aquatics/",
  "direct_source": {
    "configuration": {
      "capture": {
        "browser_version": "152.0.7977.64",
        "captured_at": "2026-10-23T20:33:07.781Z",
        "configuration": {
          "playwright_version": "1.61.1",
          "script_sha256": "8e5c24db09d052cd63888ed77acc3a6a5273434b12f71ed7a2ac03e786535ae4"
        },
        "hashes": {
          "rendered": "511c0533e3efc02f8ade97284d9d6db14b8869566eb5634e5f5614d262893603",
          "screenshot": "bb5e6ec63af1058538a9d4293cf99f02a7ee1670d185f3b11c3be4faa13bf4e0",
          "source": "beee5f5fe269e0445b7464896a5c585aaf4f5fa760b1f411148851366c62a2a8"
        },
        "method": "cloudflare_browser",
        "requested_url": "https://www.jccsf.org/fitness/aquatics/",
        "status": 200,
        "url": "https://www.jccsf.org/fitness/aquatics/"
      },
      "freshness_days": 14,
      "libraries": {
        "httpx": "0.28.1",
        "openpyxl": "3.1.5"
      },
      "parser_sha256": "a9c5a177a53291230d1471ff965c3a06d43957624269d9f6b14be76e2ce6bc7f",
      "python": "3.13.16",
      "schema_sha256": "987dbc4e2feff8d5edb6362ff40bd7a0ed6b093a4fbef21dcfc9a51e10832bcc",
      "source_identity": "original_bytes"
    },
    "freshness_days": 14,
    "observed_on": "2026-10-23",
    "requested_url": "https://www.jccsf.org/fitness/aquatics/",
    "sha256": "beee5f5fe269e0445b7464896a5c585aaf4f5fa760b1f411148851366c62a2a8",
    "url": "https://www.jccsf.org/fitness/aquatics/"
  },
  "slug": "jccsf",
  "reviewed_at": "2026-10-23",
  "attested_by": "ci",
  "payload": {
    "access_exceptions": [],
    "access_hours": [],
    "closures": [],
    "effective_end": "2026-11-05",
    "effective_start": "2026-10-23",
    "schedule_basis": "swim_schedule",
    "sessions": [
      {
        "day": "monday",
        "end": "12:00",
        "evidence": "Monday & Wednesday: 5:30 am \u2013 Noon, 1:30 \u2013 9:45 pm",
        "pool": "rec",
        "start": "05:30",
        "type": "family_swim"
      },
      {
        "day": "monday",
        "end": "21:45",
        "evidence": "Monday \u2013 Friday: 5:30 am \u2013 9:45 pm",
        "pool": "lap",
        "start": "05:30",
        "type": "lap_swim"
      },
      {
        "day": "monday",
        "end": "21:45",
        "evidence": "Monday & Wednesday: 5:30 am \u2013 Noon, 1:30 \u2013 9:45 pm",
        "pool": "rec",
        "start": "13:30",
        "type": "family_swim"
      },
      {
        "day": "tuesday",
        "end": "11:30",
        "evidence": "Tuesday: 5:30 \u2013 11:30 am, 2:00 \u2013 9:45 pm",
        "pool": "rec",
        "start": "05:30",
        "type": "family_swim"
      },
      {
        "day": "tuesday",
        "end": "21:45",
        "evidence": "Monday \u2013 Friday: 5:30 am \u2013 9:45 pm",
        "pool": "lap",
        "start": "05:30",
        "type": "lap_swim"
      },
      {
        "day": "tuesday",
        "end": "21:45",
        "evidence": "Tuesday: 5:30 \u2013 11:30 am, 2:00 \u2013 9:45 pm",
        "pool": "rec",
        "start": "14:00",
        "type": "family_swim"
      },
      {
        "day": "wednesday",
        "end": "12:00",
        "evidence": "Monday & Wednesday: 5:30 am \u2013 Noon, 1:30 \u2013 9:45 pm",
        "pool": "rec",
        "start": "05:30",
        "type": "family_swim"
      },
      {
        "day": "wednesday",
        "end": "21:45",
        "evidence": "Monday \u2013 Friday: 5:30 am \u2013 9:45 pm",
        "pool": "lap",
        "start": "05:30",
        "type": "lap_swim"
      },
      {
        "day": "wednesday",
        "end": "21:45",
        "evidence": "Monday & Wednesday: 5:30 am \u2013 Noon, 1:30 \u2013 9:45 pm",
        "pool": "rec",
        "start": "13:30",
        "type": "family_swim"
      },
      {
        "day": "thursday",
        "end": "12:00",
        "evidence": "Thursday: 5:30 am \u2013 Noon, 2:00 \u2013 9:45 pm",
        "pool": "rec",
        "start": "05:30",
        "type": "family_swim"
      },
      {
        "day": "thursday",
        "end": "21:45",
        "evidence": "Monday \u2013 Friday: 5:30 am \u2013 9:45 pm",
        "pool": "lap",
        "start": "05:30",
        "type": "lap_swim"
      },
      {
        "day": "thursday",
        "end": "21:45",
        "evidence": "Thursday: 5:30 am \u2013 Noon, 2:00 \u2013 9:45 pm",
        "pool": "rec",
        "start": "14:00",
        "type": "family_swim"
      },
      {
        "day": "friday",
        "end": "12:00",
        "evidence": "Friday: 5:30 \u2013 Noon, 1:30 \u2013 9:45 pm",
        "pool": "rec",
        "start": "05:30",
        "type": "family_swim"
      },
      {
        "day": "friday",
        "end": "21:45",
        "evidence": "Monday \u2013 Friday: 5:30 am \u2013 9:45 pm",
        "pool": "lap",
        "start": "05:30",
        "type": "lap_swim"
      },
      {
        "day": "friday",
        "end": "21:45",
        "evidence": "Friday: 5:30 \u2013 Noon, 1:30 \u2013 9:45 pm",
        "pool": "rec",
        "start": "13:30",
        "type": "family_swim"
      },
      {
        "day": "saturday",
        "end": "08:00",
        "evidence": "Saturday & Sunday: 7:00 \u2013 8:00 am, 2:00 \u2013 6:45 pm",
        "pool": "rec",
        "start": "07:00",
        "type": "family_swim"
      },
      {
        "day": "saturday",
        "end": "18:45",
        "evidence": "Saturday & Sunday: 7:00 am \u2013 6:45 pm*",
        "pool": "lap",
        "start": "07:00",
        "type": "lap_swim"
      },
      {
        "day": "saturday",
        "end": "18:45",
        "evidence": "Saturday & Sunday: 7:00 \u2013 8:00 am, 2:00 \u2013 6:45 pm",
        "pool": "rec",
        "start": "14:00",
        "type": "family_swim"
      },
      {
        "day": "sunday",
        "end": "08:00",
        "evidence": "Saturday & Sunday: 7:00 \u2013 8:00 am, 2:00 \u2013 6:45 pm",
        "pool": "rec",
        "start": "07:00",
        "type": "family_swim"
      },
      {
        "day": "sunday",
        "end": "18:00",
        "evidence": "Saturday & Sunday: 7:00 am \u2013 6:45 pm*",
        "pool": "lap",
        "start": "07:00",
        "type": "lap_swim"
      },
      {
        "day": "sunday",
        "end": "18:00",
        "evidence": "Saturday & Sunday: 7:00 \u2013 8:00 am, 2:00 \u2013 6:45 pm",
        "pool": "rec",
        "start": "14:00",
        "type": "family_swim"
      },
      {
        "day": "sunday",
        "end": "18:45",
        "evidence": "Saturday & Sunday: 7:00 \u2013 8:00 am, 2:00 \u2013 6:45 pm",
        "excluded_dates": [],
        "pool": "rec",
        "start": "18:00",
        "type": "family_swim"
      },
      {
        "day": "sunday",
        "end": "18:45",
        "evidence": "Saturday & Sunday: 7:00 am \u2013 6:45 pm*",
        "excluded_dates": [],
        "pool": "lap",
        "start": "18:00",
        "type": "lap_swim"
      }
    ]
  }
}
