{
  "pdf_sha256": "ff3b4a7f168e2cc6088044612b939d3654ded689a7eb545d2016a53f61d448f9",
  "source_pdf_url": "https://www.bayclubs.com/clubs/thegateway",
  "direct_source": {
    "configuration": {
      "freshness_days": 14,
      "libraries": {
        "httpx": "0.28.1",
        "openpyxl": "3.1.5"
      },
      "parser_sha256": "9245e06e2229752047aaba1751039838af82ef712e92181292551a5381e90e57",
      "python": "3.13.15",
      "schema_sha256": "987dbc4e2feff8d5edb6362ff40bd7a0ed6b093a4fbef21dcfc9a51e10832bcc",
      "source_identity": "original_bytes"
    },
    "freshness_days": 14,
    "observed_on": "2026-10-05",
    "requested_url": "https://www.bayclubs.com/clubs/thegateway",
    "sha256": "ff3b4a7f168e2cc6088044612b939d3654ded689a7eb545d2016a53f61d448f9",
    "url": "https://www.bayclubs.com/clubs/thegateway"
  },
  "slug": "bay-club-gateway",
  "reviewed_at": "2026-10-05",
  "attested_by": "ci",
  "payload": {
    "access_exceptions": [],
    "access_hours": [
      {
        "day": "monday",
        "end": "21:00",
        "evidence": "Mon: 6:00 am - 9:00 pm",
        "label": "Club hours",
        "start": "06:00"
      },
      {
        "day": "tuesday",
        "end": "21:00",
        "evidence": "Tue: 6:00 am - 9:00 pm",
        "label": "Club hours",
        "start": "06:00"
      },
      {
        "day": "wednesday",
        "end": "21:00",
        "evidence": "Wed: 6:00 am - 9:00 pm",
        "label": "Club hours",
        "start": "06:00"
      },
      {
        "day": "thursday",
        "end": "21:00",
        "evidence": "Thu: 6:00 am - 9:00 pm",
        "label": "Club hours",
        "start": "06:00"
      },
      {
        "day": "friday",
        "end": "21:00",
        "evidence": "Fri: 6:00 am - 9:00 pm",
        "label": "Club hours",
        "start": "06:00"
      },
      {
        "day": "saturday",
        "end": "20:00",
        "evidence": "Sat: 7:00 am - 8:00 pm",
        "label": "Club hours",
        "start": "07:00"
      },
      {
        "day": "sunday",
        "end": "20:00",
        "evidence": "Sun: 7:00 am - 8:00 pm",
        "label": "Club hours",
        "start": "07:00"
      }
    ],
    "closures": [],
    "effective_end": "2026-10-18",
    "effective_start": "2026-10-05",
    "schedule_basis": "facility_hours",
    "sessions": []
  }
}
