{
  "pdf_sha256": "64bb09139e4545d2d0c8c8a9d5c4b1fd1d2253a071040aacbc38834a6f889e87",
  "source_pdf_url": "https://fitnesssf.com/location/fillmore",
  "direct_source": {
    "configuration": {
      "freshness_days": 14,
      "libraries": {
        "httpx": "0.28.1",
        "openpyxl": "3.1.5"
      },
      "parser_sha256": "9245e06e2229752047aaba1751039838af82ef712e92181292551a5381e90e57",
      "python": "3.13.16",
      "schema_sha256": "987dbc4e2feff8d5edb6362ff40bd7a0ed6b093a4fbef21dcfc9a51e10832bcc",
      "source_identity": "original_bytes"
    },
    "freshness_days": 14,
    "observed_on": "2026-10-12",
    "requested_url": "https://fitnesssf.com/location/fillmore",
    "sha256": "64bb09139e4545d2d0c8c8a9d5c4b1fd1d2253a071040aacbc38834a6f889e87",
    "url": "https://fitnesssf.com/location/fillmore"
  },
  "slug": "fitness-sf-fillmore",
  "reviewed_at": "2026-10-12",
  "attested_by": "ci",
  "payload": {
    "access_exceptions": [],
    "access_hours": [
      {
        "day": "monday",
        "end": "23:59",
        "evidence": "Mon - Thu: 5 am - 12 am",
        "label": "Club hours",
        "start": "05:00"
      },
      {
        "day": "tuesday",
        "end": "23:59",
        "evidence": "Mon - Thu: 5 am - 12 am",
        "label": "Club hours",
        "start": "05:00"
      },
      {
        "day": "wednesday",
        "end": "23:59",
        "evidence": "Mon - Thu: 5 am - 12 am",
        "label": "Club hours",
        "start": "05:00"
      },
      {
        "day": "thursday",
        "end": "23:59",
        "evidence": "Mon - Thu: 5 am - 12 am",
        "label": "Club hours",
        "start": "05:00"
      },
      {
        "day": "friday",
        "end": "23:00",
        "evidence": "Fri: 5 am - 11 pm",
        "label": "Club hours",
        "start": "05:00"
      },
      {
        "day": "saturday",
        "end": "20:00",
        "evidence": "Sat - Sun: 7 am - 8 pm",
        "label": "Club hours",
        "start": "07:00"
      },
      {
        "day": "sunday",
        "end": "20:00",
        "evidence": "Sat - Sun: 7 am - 8 pm",
        "label": "Club hours",
        "start": "07:00"
      }
    ],
    "closures": [],
    "effective_end": "2026-10-25",
    "effective_start": "2026-10-12",
    "schedule_basis": "facility_hours",
    "sessions": []
  }
}
