{
  "slug": "north-beach-pool",
  "pdf_sha256": "f981721f29912aa82bfa0bcf2957235d92da8b453350803d5f697e82c2a240cb",
  "reviewed_at": "2026-06-06",
  "source_pdf_url": "https://sfrecpark.org/DocumentCenter/View/29330",
  "payload": {
    "closures": [
      {
        "end": "2026-06-19",
        "reason": "Juneteenth",
        "start": "2026-06-19",
        "reason_code": "juneteenth"
      },
      {
        "end": "2026-07-04",
        "reason": "Independence Day",
        "start": "2026-07-04",
        "reason_code": "independence_day"
      }
    ],
    "schedule_basis": "swim_schedule",
    "effective_start": "2026-06-09",
    "effective_end": "2026-08-15",
    "sessions": [
      {
        "day": "tuesday",
        "end": "08:00",
        "evidence": "7-8 AM C/W/T",
        "pool": "c/w/t",
        "start": "07:00",
        "type": "lap_swim",
        "notes": "Reviewer checked against consolidated North Beach PDF 29330 with C/W/T pool legend, June 9-August 15."
      },
      {
        "day": "tuesday",
        "end": "13:00",
        "evidence": "10:15-1:00 PM C",
        "pool": "c",
        "start": "10:15",
        "type": "lap_swim"
      },
      {
        "day": "tuesday",
        "end": "13:00",
        "evidence": "12-1 PM W/T",
        "pool": "w/t",
        "start": "12:00",
        "type": "lap_swim"
      },
      {
        "day": "tuesday",
        "end": "15:45",
        "evidence": "1:30-3:45 PM C",
        "pool": "c",
        "start": "13:30",
        "type": "lap_swim"
      },
      {
        "day": "tuesday",
        "end": "18:30",
        "evidence": "5:30-6:30 PM C/W/T",
        "pool": "c/w/t",
        "start": "17:30",
        "type": "lap_swim"
      },
      {
        "day": "wednesday",
        "end": "12:30",
        "evidence": "10:15 AM-12:30PM C",
        "pool": "c",
        "start": "10:15",
        "type": "lap_swim"
      },
      {
        "day": "wednesday",
        "end": "15:45",
        "evidence": "1-3:45 PM C",
        "pool": "c",
        "start": "13:00",
        "type": "lap_swim"
      },
      {
        "day": "wednesday",
        "end": "19:00",
        "evidence": "5:30-7 PM C",
        "pool": "c",
        "start": "17:30",
        "type": "lap_swim"
      },
      {
        "day": "thursday",
        "end": "08:00",
        "evidence": "7-8 AM C/W/T",
        "pool": "c/w/t",
        "start": "07:00",
        "type": "lap_swim"
      },
      {
        "day": "thursday",
        "end": "13:00",
        "evidence": "10:15-1:00 PM C",
        "pool": "c",
        "start": "10:15",
        "type": "lap_swim"
      },
      {
        "day": "thursday",
        "end": "13:00",
        "evidence": "12-1 PM W/T",
        "pool": "w/t",
        "start": "12:00",
        "type": "lap_swim"
      },
      {
        "day": "thursday",
        "end": "15:45",
        "evidence": "1:30-3:45 PM C",
        "pool": "c",
        "start": "13:30",
        "type": "lap_swim"
      },
      {
        "day": "thursday",
        "end": "18:30",
        "evidence": "5:30-6:30 PM C/W/T",
        "pool": "c/w/t",
        "start": "17:30",
        "type": "lap_swim"
      },
      {
        "day": "friday",
        "end": "12:30",
        "evidence": "10:15 AM-12:30PM C",
        "pool": "c",
        "start": "10:15",
        "type": "lap_swim"
      },
      {
        "day": "friday",
        "end": "15:45",
        "evidence": "1-3:45 PM C",
        "pool": "c",
        "start": "13:00",
        "type": "lap_swim"
      },
      {
        "day": "friday",
        "end": "19:00",
        "evidence": "5:30-7 PM C",
        "pool": "c",
        "start": "17:30",
        "type": "lap_swim"
      },
      {
        "day": "saturday",
        "end": "15:00",
        "evidence": "12-3 PM C",
        "pool": "c",
        "start": "12:00",
        "type": "lap_swim"
      },
      {
        "day": "saturday",
        "end": "16:30",
        "evidence": "3:30-4:30 PM C",
        "pool": "c",
        "start": "15:30",
        "type": "lap_swim"
      },
      {
        "day": "tuesday",
        "end": "11:45",
        "evidence": "10:15-11:45 AM W",
        "pool": "w",
        "start": "10:15",
        "type": "family_swim"
      },
      {
        "day": "tuesday",
        "end": "15:30",
        "evidence": "1:30-3:30 PM W",
        "pool": "w",
        "start": "13:30",
        "type": "family_swim"
      },
      {
        "day": "wednesday",
        "end": "15:30",
        "evidence": "1:00-3:30 PM W",
        "pool": "w",
        "start": "13:00",
        "type": "family_swim"
      },
      {
        "day": "wednesday",
        "end": "18:30",
        "evidence": "5:30-6:30 PM W",
        "pool": "w",
        "start": "17:30",
        "type": "family_swim"
      },
      {
        "day": "thursday",
        "end": "11:45",
        "evidence": "10:15-11:45 AM W",
        "pool": "w",
        "start": "10:15",
        "type": "family_swim"
      },
      {
        "day": "thursday",
        "end": "15:30",
        "evidence": "1:30-3:30 PM W",
        "pool": "w",
        "start": "13:30",
        "type": "family_swim"
      },
      {
        "day": "friday",
        "end": "15:30",
        "evidence": "1:00-3:30 PM W",
        "pool": "w",
        "start": "13:00",
        "type": "family_swim"
      },
      {
        "day": "friday",
        "end": "19:00",
        "evidence": "5:30-7:00 PM W",
        "pool": "w",
        "start": "17:30",
        "type": "family_swim"
      },
      {
        "day": "saturday",
        "end": "14:00",
        "evidence": "12:30-2 PM W",
        "pool": "w",
        "start": "12:30",
        "type": "family_swim"
      },
      {
        "day": "saturday",
        "end": "15:30",
        "evidence": "2:30-3:30 PM W",
        "pool": "w",
        "start": "14:30",
        "type": "family_swim"
      },
      {
        "day": "wednesday",
        "end": "12:30",
        "evidence": "11:30 AM-12:30 PM W",
        "pool": "w",
        "start": "11:30",
        "type": "senior_swim"
      },
      {
        "day": "friday",
        "end": "12:30",
        "evidence": "11:30 AM-12:30 PM W",
        "pool": "w",
        "start": "11:30",
        "type": "senior_swim"
      }
    ]
  }
}
