{
  "slug": "stonestown-ymca",
  "pdf_sha256": "038fca4dfa5d880382cc242297e8ec1d4ce37dc583a40472e1e65db0dc5f0ae1",
  "reviewed_at": "2026-05-17",
  "source_pdf_url": "https://www.ymcasf.org/location/stonestown-family-ymca/",
  "payload": {
    "access_hours": [
      {
        "day": "monday",
        "end": "21:00",
        "evidence": "Monday: 5:30 am \u2013 9:00 pm",
        "label": "Facility hours",
        "start": "05:30"
      },
      {
        "day": "tuesday",
        "end": "21:00",
        "evidence": "Tuesday: 5:30 am \u2013 9:00 pm",
        "label": "Facility hours",
        "start": "05:30"
      },
      {
        "day": "wednesday",
        "end": "21:00",
        "evidence": "Wednesday: 5:30 am \u2013 9:00 pm",
        "label": "Facility hours",
        "start": "05:30"
      },
      {
        "day": "thursday",
        "end": "21:00",
        "evidence": "Thursday: 5:30 am \u2013 9:00 pm",
        "label": "Facility hours",
        "start": "05:30"
      },
      {
        "day": "friday",
        "end": "21:00",
        "evidence": "Friday: 5:30 am \u2013 9:00 pm",
        "label": "Facility hours",
        "start": "05:30"
      },
      {
        "day": "saturday",
        "end": "17:00",
        "evidence": "Saturday: 7:00 am \u2013 5:00 pm",
        "label": "Facility hours",
        "start": "07:00"
      },
      {
        "day": "sunday",
        "end": "17:00",
        "evidence": "Sunday: 7:00 am \u2013 5:00 pm",
        "label": "Facility hours",
        "start": "07:00"
      }
    ],
    "closures": [],
    "schedule_basis": "facility_hours",
    "effective_start": "2026-05-17",
    "sessions": []
  }
}
