{
  "pdf_sha256": "3accb664f6c976b0fe2feb7259754121408112fac6684095bd431d86b7fc59a5",
  "source_pdf_url": "https://www.ymcasf.org/location/embarcadero-ymca/",
  "direct_source": {
    "configuration": {
      "capture": {
        "browser_version": "152.0.7977.64",
        "captured_at": "2026-10-24T18:36:16.483Z",
        "configuration": {
          "playwright_version": "1.61.1",
          "script_sha256": "8e5c24db09d052cd63888ed77acc3a6a5273434b12f71ed7a2ac03e786535ae4"
        },
        "hashes": {
          "rendered": "525883ac188bc54308375d67e3f8578db1ea3e357ccd4552167714af657f6bf3",
          "screenshot": "98cc23b477633ac36aa8cf3715486acc66418da2d8132232442aa7364c8f522f",
          "source": "2decfbc86f7241ef1391209a86a7a211efe326ba04c279d2fc9a10b306097ca7"
        },
        "method": "cloudflare_browser",
        "requested_url": "https://www.ymcasf.org/location/embarcadero-ymca/",
        "status": 200,
        "url": "https://www.ymcasf.org/location/embarcadero-ymca/"
      },
      "freshness_days": 14,
      "libraries": {
        "httpx": "0.28.1",
        "openpyxl": "3.1.5"
      },
      "parser_sha256": "a9c5a177a53291230d1471ff965c3a06d43957624269d9f6b14be76e2ce6bc7f",
      "python": "3.13.16",
      "schema_sha256": "987dbc4e2feff8d5edb6362ff40bd7a0ed6b093a4fbef21dcfc9a51e10832bcc",
      "source_identity": "original_bytes"
    },
    "freshness_days": 14,
    "observed_on": "2026-10-24",
    "requested_url": "https://www.ymcasf.org/location/embarcadero-ymca/",
    "sha256": "3accb664f6c976b0fe2feb7259754121408112fac6684095bd431d86b7fc59a5",
    "url": "https://www.ymcasf.org/location/embarcadero-ymca/"
  },
  "slug": "embarcadero-ymca",
  "reviewed_at": "2026-10-24",
  "attested_by": "ci",
  "payload": {
    "access_exceptions": [],
    "access_hours": [
      {
        "day": "monday",
        "end": "20:30",
        "evidence": "Monday: 5:30 am \u2013 9:00 pm",
        "label": "Pool hours",
        "start": "06:00"
      },
      {
        "day": "tuesday",
        "end": "20:30",
        "evidence": "Tuesday: 5:30 am \u2013 9:00 pm",
        "label": "Pool hours",
        "start": "06:00"
      },
      {
        "day": "wednesday",
        "end": "20:30",
        "evidence": "Wednesday: 5:30 am \u2013 9:00 pm",
        "label": "Pool hours",
        "start": "06:00"
      },
      {
        "day": "thursday",
        "end": "20:30",
        "evidence": "Thursday: 5:30 am \u2013 9:00 pm",
        "label": "Pool hours",
        "start": "06:00"
      },
      {
        "day": "friday",
        "end": "20:30",
        "evidence": "Friday: 5:30 am \u2013 9:00 pm",
        "label": "Pool hours",
        "start": "06:00"
      },
      {
        "day": "saturday",
        "end": "16:30",
        "evidence": "Saturday: 7:00 am \u2013 5:00 pm",
        "label": "Pool hours",
        "start": "07:30"
      }
    ],
    "closures": [],
    "effective_end": "2026-11-06",
    "effective_start": "2026-10-24",
    "schedule_basis": "pool_hours",
    "sessions": []
  }
}
