{
  "pdf_sha256": "b31d84163fdcf4cc28f2d72af92ed6198fdcf3a0f8e4bedec65444d38df88a8f",
  "source_pdf_url": "https://www.ymcasf.org/location/stonestown-family-ymca/",
  "direct_source": {
    "configuration": {
      "capture": {
        "browser_version": "152.0.7977.64",
        "captured_at": "2026-10-24T18:36:10.972Z",
        "configuration": {
          "playwright_version": "1.61.1",
          "script_sha256": "8e5c24db09d052cd63888ed77acc3a6a5273434b12f71ed7a2ac03e786535ae4"
        },
        "hashes": {
          "rendered": "57b7b6714eb44e1002af1fb9d8e7020c3f4fad820d6a770a3e4dfec090b83796",
          "screenshot": "4b1454f6c86accb3a9234213a520d2c61a0fe1ba8387bc733d302a96bb84310e",
          "source": "179f25321a482fd90099e43e72e6fcfa155fb4791fa2d50a3498ebf99330e404"
        },
        "method": "cloudflare_browser",
        "requested_url": "https://www.ymcasf.org/location/stonestown-family-ymca/",
        "status": 200,
        "url": "https://www.ymcasf.org/location/stonestown-family-ymca/"
      },
      "freshness_days": 14,
      "libraries": {
        "httpx": "0.28.1",
        "openpyxl": "3.1.5"
      },
      "parser_sha256": "a9c5a177a53291230d1471ff965c3a06d43957624269d9f6b14be76e2ce6bc7f",
      "python": "3.13.16",
      "schema_sha256": "987dbc4e2feff8d5edb6362ff40bd7a0ed6b093a4fbef21dcfc9a51e10832bcc",
      "source_identity": "original_bytes"
    },
    "freshness_days": 14,
    "observed_on": "2026-10-24",
    "requested_url": "https://www.ymcasf.org/location/stonestown-family-ymca/",
    "sha256": "b31d84163fdcf4cc28f2d72af92ed6198fdcf3a0f8e4bedec65444d38df88a8f",
    "url": "https://www.ymcasf.org/location/stonestown-family-ymca/"
  },
  "slug": "stonestown-ymca",
  "reviewed_at": "2026-10-24",
  "attested_by": "ci",
  "payload": {
    "access_exceptions": [],
    "access_hours": [
      {
        "day": "monday",
        "end": "21:00",
        "evidence": "Monday: 5:30 am \u2013 9:00 pm",
        "label": "Facility hours",
        "start": "05:30"
      },
      {
        "day": "tuesday",
        "end": "21:00",
        "evidence": "Tuesday: 5:30 am \u2013 9:00 pm",
        "label": "Facility hours",
        "start": "05:30"
      },
      {
        "day": "wednesday",
        "end": "21:00",
        "evidence": "Wednesday: 5:30 am \u2013 9:00 pm",
        "label": "Facility hours",
        "start": "05:30"
      },
      {
        "day": "thursday",
        "end": "21:00",
        "evidence": "Thursday: 5:30 am \u2013 9:00 pm",
        "label": "Facility hours",
        "start": "05:30"
      },
      {
        "day": "friday",
        "end": "21:00",
        "evidence": "Friday: 5:30 am \u2013 9:00 pm",
        "label": "Facility hours",
        "start": "05:30"
      },
      {
        "day": "saturday",
        "end": "17:00",
        "evidence": "Saturday: 7:00 am \u2013 5:00 pm",
        "label": "Facility hours",
        "start": "07:00"
      },
      {
        "day": "sunday",
        "end": "17:00",
        "evidence": "Sunday: 7:00 am \u2013 5:00 pm",
        "label": "Facility hours",
        "start": "07:00"
      }
    ],
    "closures": [],
    "effective_end": "2026-11-06",
    "effective_start": "2026-10-24",
    "schedule_basis": "facility_hours",
    "sessions": []
  }
}
