{
  "pdf_sha256": "8f7f3cbf0bf441cceddb6576c015a08edd318fa07d395185f9c9a7ad61408741",
  "source_pdf_url": "https://campuslifeserviceshome.ucsf.edu/fitness-and-recreation/news/2026-fitness-and-recreation-holiday-schedule",
  "direct_source": {
    "configuration": {
      "freshness_days": 14,
      "libraries": {
        "httpx": "0.28.1",
        "openpyxl": "3.1.5"
      },
      "parser_sha256": "e8ad66fa5b3fd21d553df2a86588ab0a67e57ada3111b1cd3f432f6cd538a078",
      "python": "3.13.15",
      "schema_sha256": "987dbc4e2feff8d5edb6362ff40bd7a0ed6b093a4fbef21dcfc9a51e10832bcc",
      "source_identity": "original_bytes"
    },
    "freshness_days": 14,
    "observed_on": "2026-09-09",
    "requested_url": "https://campuslifeserviceshome.ucsf.edu/fitness-and-recreation/news/2026-fitness-and-recreation-holiday-schedule",
    "sha256": "8f7f3cbf0bf441cceddb6576c015a08edd318fa07d395185f9c9a7ad61408741",
    "url": "https://campuslifeserviceshome.ucsf.edu/fitness-and-recreation/news/2026-fitness-and-recreation-holiday-schedule"
  },
  "slug": "ucsf-millberry",
  "reviewed_at": "2026-09-09",
  "attested_by": "ci",
  "payload": {
    "access_exceptions": [],
    "access_hours": [
      {
        "day": "monday",
        "end": "21:00",
        "evidence": "Monday-Friday 6:00 am-9:00 pm (Bakar and Millberry)",
        "label": "Facility hours",
        "start": "06:00"
      },
      {
        "day": "tuesday",
        "end": "21:00",
        "evidence": "Monday-Friday 6:00 am-9:00 pm (Bakar and Millberry)",
        "label": "Facility hours",
        "start": "06:00"
      },
      {
        "day": "wednesday",
        "end": "21:00",
        "evidence": "Monday-Friday 6:00 am-9:00 pm (Bakar and Millberry)",
        "label": "Facility hours",
        "start": "06:00"
      },
      {
        "day": "thursday",
        "end": "21:00",
        "evidence": "Monday-Friday 6:00 am-9:00 pm (Bakar and Millberry)",
        "label": "Facility hours",
        "start": "06:00"
      },
      {
        "day": "friday",
        "end": "21:00",
        "evidence": "Monday-Friday 6:00 am-9:00 pm (Bakar and Millberry)",
        "label": "Facility hours",
        "start": "06:00"
      },
      {
        "day": "saturday",
        "end": "16:00",
        "evidence": "Saturday-Sunday 8:00 am-4:00 pm (Millberry)",
        "label": "Facility hours",
        "start": "08:00"
      },
      {
        "day": "sunday",
        "end": "16:00",
        "evidence": "Saturday-Sunday 8:00 am-4:00 pm (Millberry)",
        "label": "Facility hours",
        "start": "08:00"
      }
    ],
    "closures": [],
    "effective_end": "2026-09-22",
    "effective_start": "2026-09-09",
    "schedule_basis": "facility_hours",
    "sessions": []
  }
}
