{
  "pdf_sha256": "918c7c10e2e170548c65659bbc2bdfa6a23316c2468987804703c037919a2402",
  "source_pdf_url": "https://www.equinox.com/clubs/northern-california/sportsclubsanfrancisco",
  "direct_source": {
    "configuration": {
      "freshness_days": 14,
      "libraries": {
        "httpx": "0.28.1",
        "openpyxl": "3.1.5"
      },
      "parser_sha256": "9245e06e2229752047aaba1751039838af82ef712e92181292551a5381e90e57",
      "python": "3.13.15",
      "schema_sha256": "987dbc4e2feff8d5edb6362ff40bd7a0ed6b093a4fbef21dcfc9a51e10832bcc",
      "source_identity": "original_bytes"
    },
    "freshness_days": 14,
    "observed_on": "2026-10-05",
    "requested_url": "https://www.equinox.com/clubs/northern-california/sportsclubsanfrancisco",
    "sha256": "918c7c10e2e170548c65659bbc2bdfa6a23316c2468987804703c037919a2402",
    "url": "https://www.equinox.com/clubs/northern-california/sportsclubsanfrancisco"
  },
  "slug": "equinox-sports-club-sf",
  "reviewed_at": "2026-10-05",
  "attested_by": "ci",
  "payload": {
    "access_exceptions": [],
    "access_hours": [
      {
        "day": "monday",
        "end": "22:00",
        "evidence": "Monday: 05:00\u201322:00",
        "label": "Club hours",
        "start": "05:00"
      },
      {
        "day": "tuesday",
        "end": "22:00",
        "evidence": "Tuesday: 05:00\u201322:00",
        "label": "Club hours",
        "start": "05:00"
      },
      {
        "day": "wednesday",
        "end": "22:00",
        "evidence": "Wednesday: 05:00\u201322:00",
        "label": "Club hours",
        "start": "05:00"
      },
      {
        "day": "thursday",
        "end": "22:00",
        "evidence": "Thursday: 05:00\u201322:00",
        "label": "Club hours",
        "start": "05:00"
      },
      {
        "day": "friday",
        "end": "21:00",
        "evidence": "Friday: 05:00\u201321:00",
        "label": "Club hours",
        "start": "05:00"
      },
      {
        "day": "saturday",
        "end": "19:00",
        "evidence": "Saturday: 07:00\u201319:00",
        "label": "Club hours",
        "start": "07:00"
      },
      {
        "day": "sunday",
        "end": "19:00",
        "evidence": "Sunday: 07:00\u201319:00",
        "label": "Club hours",
        "start": "07:00"
      }
    ],
    "closures": [],
    "effective_end": "2026-10-18",
    "effective_start": "2026-10-05",
    "schedule_basis": "facility_hours",
    "sessions": []
  }
}
